<?xml version="1.0" encoding="UTF-8"?>
<!--Sample XML file generated by XMLSpy v2013 sp1 (x64) (http://www.altova.com)-->
<tns:CreatePipelineCursorRequest xsi:schemaLocation="http://www.elliemae.com/services/pipelinecursor PipelineCursorSvc.xsd" xmlns:tns="http://www.elliemae.com/services/pipelinecursor" xmlns:xsi="http://www.w3.org/2001/XMLSchema-instance">
	<tns:ExternalOrgId>String</tns:ExternalOrgId>
	<tns:Fields>
		<tns:PipelineField>
			<tns:Name>String</tns:Name>
		</tns:PipelineField>
	</tns:Fields>
	<tns:FieldSort>
		<tns:PipelineField>
			<tns:Name>String</tns:Name>
			<tns:SortOrder>Descending</tns:SortOrder>
		</tns:PipelineField>
	</tns:FieldSort>
	<tns:Filter>
		<tns:FilterCriterion>
			<tns:CriterionName>String</tns:CriterionName>
			<tns:FieldDescription>String</tns:FieldDescription>
			<tns:FieldID>String</tns:FieldID>
			<tns:FieldType>String</tns:FieldType>
			<tns:JointToken>None</tns:JointToken>
			<tns:LeftParentheses>0</tns:LeftParentheses>
			<tns:OpType>String</tns:OpType>
			<tns:RightParentheses>0</tns:RightParentheses>
			<tns:ValueFrom>String</tns:ValueFrom>
			<tns:ValueTo>String</tns:ValueTo>
		</tns:FilterCriterion>
	</tns:Filter>
	<tns:LoanFolder>String</tns:LoanFolder>
	<tns:OrgType>TPO</tns:OrgType>
	<tns:Ownership>All</tns:Ownership>
	<tns:PipelineItemRequired>String</tns:PipelineItemRequired>
	<tns:StartIndex>0</tns:StartIndex>
	<tns:EndIndex>0</tns:EndIndex>
</tns:CreatePipelineCursorRequest>

TEST 1
TEST 4